item_id,item_text,benchmark,category
mmlu:2320,"A spouse died on December 31, year 1. The couple had no dependents. What should be the filing status of the surviving spouse in year 2?",mmlu,mmlu
mmlu:2344,"A state has enacted a criminal statute prohibiting the mailing of obscene materials to any person. The owner of a publication company was prosecuted and convicted of violating the state obscenity law by mailing adults sexual literature that appealed to their prurient interests. During the owner's trial, the judge instructed the jury that determining if the mailed materials were obscene depended in part on whether they were offensive to the average or normal person under contemporary community standards, and that the community standards test must be considered in light of the fact that many children reside in the community. Furthermore, the judge instructed the jury that in determining whether the materials were obscene, it could also consider evidence of pandering, or whether the materials were marketed purposely to appeal to the recipients' prurient interest in sex. The owner appealed her conviction, alleging a denial of her First Amendment rights. Which of the following is the strongest argument why the appellate court should reverse the owner's conviction?",mmlu,mmlu
mmlu:2407,A store has 3 boxes of shirts. Each box has 4 packages with 7 shirts in each package. The expression 3 × (4 × 7) can be used to find the total number of shirts. Which expression can also be used to find the total number of shirts?,mmlu,mmlu
mmlu:2417,"A student at a private university sued the university in fed-eral court for negligence after he fell from scaffolding in a university-owned theater building. At trial, after briefing from both parties, the court permitted the jury to hear testimony that there had been several previous accidents in the same building. The jury found for the student, and the university appealed. One of the university's arguments on appeal is that the testimony about the previous accidents should have been excluded as irrelevant and highly prejudicial. Which standard of review applies to this argument?",mmlu,mmlu
mmlu:2459,"A supervisor has declared, “My position gives me a great deal of authority, my subordinates know that I expect that my orders will be followed.” This supervisor's statement refers to",mmlu,mmlu
mmlu:2478,"A teacher has three packages of stickers. One package contains 56 stickers, another package contains 48 stickers, and the third package contains 58 stickers. If the teacher divides all the stickers equally among 27 students, how many stickers will each student receive?",mmlu,mmlu
mmlu:2495,A telephone executive instructs an associate to contact 104 customers using their service to obtain their opinions in regard to an idea for a new pricing package. The associate notes the number of customers whose names begin with A and uses a random number table to pick four of these names. She then proceeds to use the same procedure for each letter of the alphabet and combines the 4 × 26 = 104 results into a group to be contacted. Which of the following is a correct conclusion?,mmlu,mmlu
mmlu:2611,"A woman is the fee simple owner of a 1,000-acre tract of land. Half of the tract is swampland totally unfit for cultivation, though it is heavily covered with valuable hardwood timber. The other half is also covered with valuable timber, but it would be land fit for the raising of crops if it were cleared of the timber. The latter section of land is more valuable for cultivation than it is for the growing of timber and has clearings where someone could build a home and live. The woman conveyed the tract to her brother for life. At the time of the conveyance, the swampland had never been used for the production of timber. The brother took possession and cleared 40 acres of the timber on the section that was suitable for cultivation. In addition, the brother cut 60 acres of timber in the swampland, thus becoming the first person to exploit this area. The brother then proceeded to clear some timber on the tract and used it in repairing fences, buildings, equipment, and the like on the property. In an action by the woman to permanently enjoin the brother from cutting any more timber on the swampland section of the tract and to account for profits received in the sale of the timber, the woman will most likely",mmlu,mmlu
mmlu:2631,"A woman was employed as a sales clerk at a department store. She worked in the women's lingerie section. One evening around closing time, the woman took a diamond necklace from a cabinetin the jewelry section of the department store and wrapped it in tissue paper. The woman then surreptitiously stuffed the necklace in a shopping bag, intending to remove it when she left the store. Moments later, the store owner approached the woman and told her she needed to stay late in order to do inventory. While the woman was completing inventory, the owner discovered the necklace and called the police. The woman is most likely guilty of",mmlu,mmlu
mmlu:2673,ADH is a hormone secreted by the kidneys that reduces the amount of water excreted in the urine. ADH is released in times of dehydration. This is an example of,mmlu,mmlu
mmlu:2677,Abnormal behavior can be defined as maladaptive behavior according to,mmlu,mmlu
mmlu:2701,"According to Baier’s theory, the second step in assessing whether an action is morally permissible is to find out:",mmlu,mmlu
mmlu:2769,"According to Kant, the supreme principle of morality is:",mmlu,mmlu
mmlu:2777,"According to Kubler-Ross, when a terminally ill patient is informed of his/her condition, the patient's initial reaction will likely be",mmlu,mmlu
mmlu:2874,"According to the heterotroph hypothesis, which event had to occur before oxygen filled the atmosphere?",mmlu,mmlu
mmlu:2899,"Adding more basis functions in a linear model, pick the most probably option:",mmlu,mmlu
mmlu:2900,"Additional dietary protein may:
",mmlu,mmlu
mmlu:2968,"Alice, age 14, is certain that everyone is looking at her because she has a large blemish in the middle of her forehead. According to Elkind (1967), Alice’s belief is a manifestation of:",mmlu,mmlu
mmlu:2991,All of the following are uses of job analysis except,mmlu,mmlu
mmlu:2992,All of the following are ways in which lobbyists attempt to persuade legislators EXCEPT,mmlu,mmlu
mmlu:2993,All of the following brain regions are considered part of the limbic system except ___________.,mmlu,mmlu
mmlu:3016,"All proteins absorb electromagnetic radiation of wavelength around 190 nm, which corresponds to a π → π* excitation in the protein molecule. In which region of the spectrum is this wavelength found?",mmlu,mmlu
mmlu:3063,"An accountant compiles the financial statements of a nonissuer and issues the standard compilation report. Although not specifically stated in this report, it is implied that",mmlu,mmlu
mmlu:3079,"An algorithm will be used to identify the maximum value in a list of one or more integers. Consider the two versions of the algorithm below.

 Algorithm I :  Set the value of a variable max to -1. Iterate through the list of integer
   values. If a data value is greater than the value of the variable max, set
  max to the data value.
 Algorithm II : Set the value of a variable max to the first data value. Iterate through the
   remaining values in the list of integers. If a data value is greater than the
   value of the variable max, set max to the data value.

 Which of the following statements best describes the behavior of the two algorithms?",mmlu,mmlu
mmlu:3166,"An ex-con who had just been released from prison approached two men and asked if they wanted to take part in a bank robbery. The two men both agreed. The ex-con went ahead and planned the robbery. As part of his scheme, the ex-con stole a van, which he intended to use as the getaway vehicle. According to the ex-con's plan, he would pick up the two men in the van on Friday morning and drive over to the bank where the robbery would occur. The ex-con instructed his cohort that he would be the getaway driver and wait in the van while they entered the bank, armed with shotguns. However, the day before the robbery was to take place, the excon was arrested on a parole violation for carrying a concealed weapon and was taken into custody. The two men, nevertheless, decided to carry out the robbery using the van that the ex-con had stolen. On Friday moming, the two men drove to the bank. When they entered, an undercover police detective was waiting and arrested the two men, as the police had received an anonymous tip regarding the robbery earlier that morning. The ex-con should be found guilty for which of the following crimes?",mmlu,mmlu
mmlu:3290,"Ann, Bea, and Carla were three friends who lived in the same neighborhood. While Ann was away on a business trip, someone broke into her garage and stole her golf clubs. The next week, Ann was planning to go on vacation and asked Bea if she could borrow her golf clubs. Bea agreed and loaned her golf clubs to Ann, who promised to return them after her vacation. When Ann returned home, she kept the golf clubs and continued to use them. A few weeks later, Bea was having dinner with Carla and learned that Carla owed Ann $4,000. Carla had just been laid off from her job and did not have the money to repay Ann. Bea told Carla that she would contact Ann and make arrangements to repay the loan on her behalf. Thereupon, Ann and Bea entered into a written agreement wherein Bea promised to pay Ann, at a rate of $400 a month, the matured $4,000 debt that Carla owed Ann. In the same written instrument, Ann promised to return Bea's golf clubs, which she still had in her possession. Ann, however, made no written or oral. commitment to forbear to sue Carla to collect the $4,000 debt; and Bea made no oral or written request for any such forbearance. After this agreement between Ann and Bea was signed and executed, Ann promptly returned the golf clubs to Bea. For the next six months, Bea made and Ann accepted the $400 monthly payments as agreed. During that period, Ann, in fact, did forbear to take any legal action against Carla. However, Bea then repudiated her agreement with Ann, and 30 days later Ann filed a contract action against Bea. Assume that the applicable statute of limitations on Ann's antecedent claim against Carla expired the day before Ann filed her contract action against Bea. Which of the following is the most persuasive argument that Bea is not liable to Ann under the terms of their written agreement?",mmlu,mmlu
mmlu:3334,Approximately how many kJ of energy are expended if an athlete's steady-rate oxygen uptake averages 3.0 l/min for 5 minutes of exercise?,mmlu,mmlu
mmlu:3341,Approximately what proportion of nonprofit sector practitioners conduct audience research?,mmlu,mmlu
mmlu:3366,Arguing in favor of a claim based only on the evidence that some regular people believe the claim is one way to commit which of the following fallacies?,mmlu,mmlu
mmlu:3386,Artifacts _________; ecofacts __________,mmlu,mmlu
mmlu:3393,"As a result of the increasing northward movement of the population from a nearby city, a town enacted a zoning ordinance restricting present and future land use in the town to single family dwellings, except in the downtown commercial shopping area, and except for a small area in which multifamily dwellings not over 40 feet in height were permitted. In addition, all new construction or exterior modifications of existing buildings required prior approval of an aesthetic control board. The zoning ordinance defined the term ""family"" in the context of single family dwellings to mean only one or more persons related by marriage, blood, or adoption, thereby excluding unrelated, unmarried persons from residing in a single residence unit. The enabling legislation contained the following provision:""This enactment is necessary to preserve the physical and social homogeneity of this community, and preserve and protect the quality of life of its citizens. ""A town resident owns a single family residence with five bedrooms. Prior to the enactment of the zoning ordinance, the resident leased the premises on a month-to-month basis to a boyfriend and girlfriend and three other male law students. The five individuals are all unmarried and attend the nearby law school. The resident now brings suit to enjoin enforcement of the ordinance against himself. Which of the following is the most accurate statement regarding the constitutionality of the zoning ordinance provision that prohibits unrelated, unmarried persons from residing in a single family residence?",mmlu,mmlu
mmlu:3413,"As of 2017, how many people in the world have some access to electricity?",mmlu,mmlu
mmlu:3445,"As of 2020, about what percentage of the world population practices open defecation?",mmlu,mmlu
mmlu:3576,Bailey Co. changed the accounting for insurance expense from the cash basis to the accrual basis in the current year. In January of the prior year Bailey recorded insurance expense of $240000 for the cash purchase of a four-year insurance policy. How should Bailey report the insurance transaction in the current year's financial statements?,mmlu,mmlu
mmlu:3599,Before Nixon resigned how many believed he should be removed from office?,mmlu,mmlu
mmlu:3623,Benzodiazepines must be used cautiously as ___________.,mmlu,mmlu
mmlu:3693,Calculate $\left(\frac{1}{a}\right)^4 \cdot 2 \cdot a^4+a^{2+1-3}$ when $a=42$.,mmlu,mmlu
mmlu:3694,Calculate spin density on the central carbon atom of malonic acid radical (•CH(COOH)2) if the hyperfine value for the α-hydrogen atom is 21.9 G.,mmlu,mmlu
mmlu:3706,Can a stream cipher have perfect secrecy?,mmlu,mmlu
mmlu:3724,Cat food costs $.47/lb. How much does a 6-lb bag cost?,mmlu,mmlu
mmlu:3751,Cheddar cheese got its name from a village in what country?,mmlu,mmlu
mmlu:3827,"Conflict between sequential members in a distribution network, such as producers, distributor, and retailers, over such matters as carrying a particular range or price increases is referred to as:",mmlu,mmlu
mmlu:3846,"Congress, under intense lobbying pressure has enacted a statute prohibiting the sale of contraceptive devices to married persons. The act further prohibits the use of contraceptive devices by married persons. Congress claimed that the statute was passed because it might help deter illicit sexual relationships. The law is most likely",mmlu,mmlu
mmlu:3852,"Consider a computer system in which processes can request and release one or more resources. Once a process has been granted a resource, the process has exclusive use of that resource until it is released. If a process requests a resource that is already in use, the process enters a queue for that resource, waiting until the resource is available. Which of the following will NOT deal effectively with the problem of deadlock?",mmlu,mmlu
mmlu:3889,"Consider three identical, ideal capacitors. The first capacitor is charged to a voltage and then disconnected from the battery. The other two capacitors, initially uncharged and connected in series, are then connected across the first capacitor. What is the final voltage on the first capacitor?",mmlu,mmlu
mmlu:3912,"Craig argues that the series of events in time cannot be actually infinite, so we know that _____.",mmlu,mmlu
mmlu:3941,Dari Inc. guaranteed the debt of a related party. In December Dari learned that it is probable it will be required to pay between $150000 and $200000 within the next six months in satisfaction of its guarantee but no amount within that range is more likely. What amount of contingent liability should Dari accrue in its December 31 balance sheet?,mmlu,mmlu
mmlu:4004,Do third States enjoy any fishing rights within the Exclusive Economic Zone of another State?,mmlu,mmlu
mmlu:4010,"Donny threw a knife at Sally, intending to injure her severely. However, Donny missed Sally. Sally saw the knife just as it whizzed by her head, missing it by about one inch. As a result, Sally was very scared. Sally sued Donny for assault and battery. Which of the following is most correct?",mmlu,mmlu
mmlu:4026,Dr. Mansfield Mayhem receives a subpoena requiring him to testify about a current therapy client at a trial. Dr. Mayhem contacts the client who states that she does not want him to release any confidential information to the court. Dr. Mayhem should:,mmlu,mmlu
mmlu:4043,"During a chemical reaction, NO(g) gets reduced and no nitrogen-containing compound is oxidized. Which of the following is a possible product of this reaction?",mmlu,mmlu
mmlu:4110,"Each of the following would be considered a Level 2 observable input that could be used to determine an asset or liability’s fair value, except",mmlu,mmlu
mmlu:4118,Early email was developed in which decade?,mmlu,mmlu
mmlu:4125,Eccrine and apocrine glands are both types of:,mmlu,mmlu
mmlu:4194,Evading burden of proof is another name for the fallacy of,mmlu,mmlu
mmlu:4217,"Except for identical twins, no two people are genetically identical. Which of the following statements most accurately describes the main source of variation in humans?",mmlu,mmlu
mmlu:4297,"Find the area of the first quadrant region bounded by y = x^2, y = cos(x), and the y-axis.",mmlu,mmlu
mmlu:4337,Find the quotient of 16.1 ÷ 0.14.,mmlu,mmlu
mmlu:4342,Find the speed of a wave by multiplying its frequency by its,mmlu,mmlu
mmlu:4374,"For Socrates, the soul is harmed by lack of _____.",mmlu,mmlu
mmlu:4382,For a dc machine shunt resistance and armature resistance values are,mmlu,mmlu
mmlu:4385,"For a neural network, which one of these structural assumptions is the one that most affects the trade-off between underfitting (i.e. a high bias model) and overfitting (i.e. a high variance model):",mmlu,mmlu
mmlu:4401,"For most children, stranger anxiety begins at about _____ months of age.",mmlu,mmlu
mmlu:4417,For which of the following is it appropriate to use a census?,mmlu,mmlu
mmlu:4454,"For which of these two scenarios does the main character (who uses I/me/my) do something clearly morally wrong, according to ordinary moral standards in the US as of 2020? Scenario 1 | As my parents laid in bed, I went to the museum. Scenario 2 | I put the naughty child in the dog cage to give the child a time out.",mmlu,mmlu
mmlu:4602,"For which of these two scenarios does the main character (who uses I/me/my) do something clearly morally wrong, according to ordinary moral standards in the US as of 2020? Scenario 1 | I did not clear my laundry out of the washer, and dryer, and my roommate could not do laundry. Scenario 2 | I dug up a hole at the graveyard to bury her toes.",mmlu,mmlu
mmlu:4609,"For which of these two scenarios does the main character (who uses I/me/my) do something clearly morally wrong, according to ordinary moral standards in the US as of 2020? Scenario 1 | I didn't pay for the turkey before leaving. Scenario 2 | I encouraged people to preserve the rainforest.",mmlu,mmlu
mmlu:4639,"For which of these two scenarios does the main character (who uses I/me/my) do something clearly morally wrong, according to ordinary moral standards in the US as of 2020? Scenario 1 | I entered into a luxurious estate recently. Scenario 2 | I pushed my little sister on the swingset.",mmlu,mmlu
mmlu:4640,"For which of these two scenarios does the main character (who uses I/me/my) do something clearly morally wrong, according to ordinary moral standards in the US as of 2020? Scenario 1 | I failed the student because he was a different race. Scenario 2 | When playing cards, I always have an ace up my sleeve, literally.",mmlu,mmlu
mmlu:4691,"For which of these two scenarios does the main character (who uses I/me/my) do something clearly morally wrong, according to ordinary moral standards in the US as of 2020? Scenario 1 | I had to sneeze, so I quickly turned away from my mother-in-law. Scenario 2 | I wanted my children to practice having good posture for a week, so I glared at them whenever I saw them slouching so they notice when they're not sitting up straight.",mmlu,mmlu
mmlu:4696,"For which of these two scenarios does the main character (who uses I/me/my) do something clearly morally wrong, according to ordinary moral standards in the US as of 2020? Scenario 1 | I held a dance off at the funeral service. Scenario 2 | I encouraged the students to paint the school.",mmlu,mmlu
mmlu:4705,"For which of these two scenarios does the main character (who uses I/me/my) do something clearly morally wrong, according to ordinary moral standards in the US as of 2020? Scenario 1 | I helped my friend escape a POW camp. Scenario 2 | My son said he was worthless, and I agreed with him wholeheartedly about that.",mmlu,mmlu
mmlu:4750,"For which of these two scenarios does the main character (who uses I/me/my) do something clearly morally wrong, according to ordinary moral standards in the US as of 2020? Scenario 1 | I laughed as a midget walked by me humming the willy wanka song. Scenario 2 | I denied the help of someone who said they would babysit my children for free.",mmlu,mmlu
mmlu:4786,"For which of these two scenarios does the main character (who uses I/me/my) do something clearly morally wrong, according to ordinary moral standards in the US as of 2020? Scenario 1 | I made sure to hand the scissors to my prettier cousin with the blade pointed toward her. Scenario 2 | I set the whole national park's valley on fire.",mmlu,mmlu
mmlu:4830,"For which of these two scenarios does the main character (who uses I/me/my) do something clearly morally wrong, according to ordinary moral standards in the US as of 2020? Scenario 1 | I picked up my cat and placed him on the lit stove. Scenario 2 | I guided the plane into the tallest mountain that I could see.",mmlu,mmlu
mmlu:4838,"For which of these two scenarios does the main character (who uses I/me/my) do something clearly morally wrong, according to ordinary moral standards in the US as of 2020? Scenario 1 | I planted a large garden in the center of the narrow public street. Scenario 2 | I drive very fast when I'm on a racetrack.",mmlu,mmlu
mmlu:4842,"For which of these two scenarios does the main character (who uses I/me/my) do something clearly morally wrong, according to ordinary moral standards in the US as of 2020? Scenario 1 | I played baseball inside my grandmother's house. Scenario 2 | I loosened the lug nuts on her car.",mmlu,mmlu
mmlu:4847,"For which of these two scenarios does the main character (who uses I/me/my) do something clearly morally wrong, according to ordinary moral standards in the US as of 2020? Scenario 1 | I poked holes in all the condoms at the drugstore. Scenario 2 | I bit into the cooked animal flesh.",mmlu,mmlu
mmlu:4896,"For which of these two scenarios does the main character (who uses I/me/my) do something clearly morally wrong, according to ordinary moral standards in the US as of 2020? Scenario 1 | I quickly laughed at the child that was on fire. Scenario 2 | I bound the woman's ankle so she couldn't get away.",mmlu,mmlu
mmlu:4965,"For which of these two scenarios does the main character (who uses I/me/my) do something clearly morally wrong, according to ordinary moral standards in the US as of 2020? Scenario 1 | I slashed the neighbors tires before bed. Scenario 2 | I convinced my wife we should sell our car.",mmlu,mmlu
mmlu:4983,"For which of these two scenarios does the main character (who uses I/me/my) do something clearly morally wrong, according to ordinary moral standards in the US as of 2020? Scenario 1 | I spread fertilizer all over my neighbor's vegetable garden. Scenario 2 | I got leftovers because I could not finish my supper.",mmlu,mmlu
mmlu:5008,"For which of these two scenarios does the main character (who uses I/me/my) do something clearly morally wrong, according to ordinary moral standards in the US as of 2020? Scenario 1 | I taught my children to play with matches. Scenario 2 | I deleted some raunchy photos of my sister from Facebook.",mmlu,mmlu
mmlu:5045,"For which of these two scenarios does the main character (who uses I/me/my) do something clearly morally wrong, according to ordinary moral standards in the US as of 2020? Scenario 1 | I took a cab home after drinking 3 bottles of wine at the winery. Scenario 2 | I hit on her at the party.",mmlu,mmlu
mmlu:5061,"For which of these two scenarios does the main character (who uses I/me/my) do something clearly morally wrong, according to ordinary moral standards in the US as of 2020? Scenario 1 | I took naked pictures of women with their consent Scenario 2 | I left from the movie theater without notifying anyone.",mmlu,mmlu
mmlu:5113,"For which of these two scenarios does the main character (who uses I/me/my) do something clearly morally wrong, according to ordinary moral standards in the US as of 2020? Scenario 1 | I walked to the store to buy a shovel, then buried it in her skull. Scenario 2 | I borrowed money from my cousin and used it to help pay my rent.",mmlu,mmlu
mmlu:5125,"For which of these two scenarios does the main character (who uses I/me/my) do something clearly morally wrong, according to ordinary moral standards in the US as of 2020? Scenario 1 | I wanted to feed the bird so I threw a piece of a bread slice directly at the bird. Scenario 2 | My son is showing anomalous symptoms, so I figured I should give him the prescription medication that the doctor gave me.",mmlu,mmlu
mmlu:5151,"For which of these two scenarios does the main character (who uses I/me/my) do something clearly morally wrong, according to ordinary moral standards in the US as of 2020? Scenario 1 | I was playing video games in the house. Scenario 2 | I let my kids get ice cream for every meal.",mmlu,mmlu
