item_id,item_text,benchmark,category
mmlu:35," According to Lee and George, ova/sperm are not human beings because",mmlu,mmlu
mmlu:47," According to Reiman, van den Haag's argument leads to the conclusion that",mmlu,mmlu
mmlu:63," According to consequentialist theories of punishment, a lawbreaker should be punished only if",mmlu,mmlu
mmlu:70," According to the basic principle of natural law theory, an action is right if and only if (and because)",mmlu,mmlu
mmlu:99," Callahan cites the Oregon Death with Dignity Legal Defense and the Education Center's finding that ""after four full years .. there have been no missteps, abuses or coercive tendencies"" regarding laws permitting euthanasia. In response he argues that",mmlu,mmlu
mmlu:168," In Baxter's view, the first and foremost step toward a solution of our environmental problems is a clear recognition that our objective is not pure air or water but rather",mmlu,mmlu
mmlu:181," In conducting international market research, there are three types of equivalence. Which of the following is NOT one of the equivalences?",mmlu,mmlu
mmlu:304," Select the best English interpretation of the given proposition, using the following translation key: Ax: x is an apartment Hx: x is a house Lx: x is large Bxy: x is bigger than y (∀x){Ax ⊃ (∀y)[(Hy • Ly) ⊃ ∼Bxy]}",mmlu,mmlu
mmlu:311, Select the best translation into predicate logic. All planets are smaller than Jupiter. (j: Jupiter; Px: x is a planet; Sxy: x is smaller than y),mmlu,mmlu
mmlu:353, The classic text Daodejing is known by what title in English?,mmlu,mmlu
mmlu:360," The most common form of cosmopolitanism is _____ cosmopolitanism, according to which those in a position to do so have an obligation to assist those in need because of poverty and to promote basic human rights.",mmlu,mmlu
mmlu:379, The view according to which wars are always (or at least nearly always) morally wrong is known as,mmlu,mmlu
mmlu:385, These store goods for moderate to long periods:,mmlu,mmlu
mmlu:399, This pricing approach is used when the firm sets prices according to how much customers are prepared to pay:,mmlu,mmlu
mmlu:410, Types of non-random samples include:,mmlu,mmlu
mmlu:450, What interior discipline must be adopted to achieve spiritual liberation within Sikhism?,mmlu,mmlu
mmlu:455, What is the foremost reason for wearing the hijab in the present day?,mmlu,mmlu
mmlu:457, What is the main reason why Arthur doesn't think that the poor have a right to aid from the affluent?,mmlu,mmlu
mmlu:518," Which of the following is a problem for Kant's principle of equality and an ""eye for an eye"" according to Nathanson?",mmlu,mmlu
mmlu:533, Which of the following is not a useful base for segmenting organizational characteristics?,mmlu,mmlu
mmlu:542, Which of the following is not one of the four main excuses for terrorism that Michael Walzer discusses?,mmlu,mmlu
mmlu:624,"""A 14-year old boy is arrested for the third time for shoplifting. His mother seems unconcerned and says """"he's just going through a phase."""" His father decides to go fishing on the day of the boy's court hearing, and his sister says she can't attend his court hearing because she has too much homework. From the perspective of structural family therapy, this family is best described as:""",mmlu,mmlu
mmlu:704,"A 15-year-old girl is brought to the office by her mother because of abdominal pain and constipation for the past several weeks. Her mother says, ""She is getting almost all A's in school and she is on the track team."" You ask the patient about her diet and she responds, ""I'm kind of a picky eater."" She requests a laxative to help with her constipation. She is 158 cm (5 ft 2 in) tall and weighs 43 kg (95 lb); BMI is 18 kg/m2 . Pulse is 65/min. Specific additional history should be obtained regarding which of the following?",mmlu,mmlu
mmlu:720,"A 19-year-old Asian female college student comes to the university health center because of a 1-week history of nasal stuffiness, occasional clear rhinorrhea, and a mild sore throat. Two days ago, she began to feel hot, but she has not taken her temperature. Medical history is unremarkable and her only medication is an oral contraceptive. She has no history of allergies. She does not smoke cigarettes. BMI is 22 kg/m2 . Vital signs are temperature 38.1°C (100.6°F), pulse 88/min, respirations 16/min, and blood pressure 116/74 mm Hg. Physical examination discloses tenderness over the left maxillary sinus without purulent drainage. There is clear fluid behind the left tympanic membrane, enlarged tonsils bilaterally, and pain with tapping of the left upper incisors. Left frontal sinus does not transilluminate. Cardiopulmonary examination discloses no abnormalities. Which of the following is the most likely underlying mechanism of this patient's sinusitis?",mmlu,mmlu
mmlu:811,"A 35-year-old man comes to the office for follow-up of sarcoidosis. His only new complaint is pain in his legs that increases with weight-bearing. He has been taking glucocorticoid therapy for the past 6 months. Vital signs now are temperature 37.0°C (98.6°F), pulse 78/min, respirations 14/min, and blood pressure 110/70 mm Hg. The patient is thin and is in no acute distress. Auscultation of the chest discloses scattered bilateral basilar crackles. There is mild left hip pain present with both active and passive range of motion. Dorsalis pedis pulse is intact. Neurologic examination is normal. Which of the following is the most likely cause of this patient's symptoms?",mmlu,mmlu
mmlu:937,A Binary number system has how many digits.,mmlu,mmlu
mmlu:978,A behavior that is elicited automatically by an environmental stimulus is called a(n),mmlu,mmlu
mmlu:993,"A box contains 4 white balls and 4 black balls. I draw them out of the box, one at a time. What is the probability that all of my draws alternate colors?",mmlu,mmlu
mmlu:1002,"A brother and his sister, who was 15 years old, had just left a movie theater late one evening and were walking toward a dimly lit parking lot to get to their car. As they reached the car, a defendant, who was visibly intoxicated, emerged from behind a trash can and approached them. The defendant knocked the brother to the ground and hit him over the head with a trash can, causing the brother to lose consciousness. The defendant then forced the sister into the car and raped her. The defendant is charged with assault with intent to commit rape, based on his attack on the brother. The defendant's best defense would be which of the following statements?",mmlu,mmlu
mmlu:1010,"A business owner had a feud and ""bitter blood"" with a former employee. One day that employee came uninvited into the owner's office brandishing a loaded shotgun, approached the owner's desk and raised the weapon. The owner, however, was secretly waiting for the opportunity. As the employee began to press on the trigger, the owner pulled a gun from her drawer and killed him. The owner admitted she felt malice toward her enemy. The authorities charged her with murder. Can she be convicted?",mmlu,mmlu
mmlu:1022,"A buyer filed a lawsuit against a seller based on a written contract allegedly executed at the time of the sale of the seller's hot dog stand to the buyer. Under the terms of the contract, the seller agreed not to open a hot dog stand for a period of two years within a distance of two miles of the old hot dog stand, now owned by the buyer. The buyer alleged in his complaint that the seller violated the contract by opening a hot dog stand one-half mile from the old location. The original contract was lost prior to trial. At trial, the buyer wants to introduce a duplicate carbon copy of the written contract. The seller objects as to the authenticity of the original written contract. The copy is",mmlu,mmlu
mmlu:1061,A change in a neuron membrane potential from +50 millivolts to -70 millivolts is considered,mmlu,mmlu
mmlu:1078,"A circus operates in a rural part of the county. It is the circus's practice to finish each day's entertainment by discharging a so-called aerial bomb into the sky. After exploding, the aerial bomb emits a spectacular rainbow fireworks display that is seen for miles around. One afternoon, a 10-year-old boy and a few friends went to the fairgrounds to see the circus. After paying their admission, they were about to enter the ""big top"" when the boy came upon an aerial bomb lying on the ground. Ignorant of what the object really was, but in an exploratory mood, the boy applied a match to the fuse of the fireworks device. It exploded and seriously injured the boy. After the accident, and before the parents of the boy had retained a lawyer, the adjuster for the circus's insurance carrier contacted the parents several times, trying to negotiate a settlement of their claim against the circus. On each occasion, the adjuster told the parents there was no need for them to hire an attorney because the applicable civil code did not provide for recovery in such a situation. The adjuster was aware that this information was blatantly false. He also warned the parents that unless they accepted his offered settlement of $5,000, they would receive nothing. For over a month, the adjuster continued to harass the parents. Outraged by the adjuster's actions, the parents sought the advice of a neighbor who recommended that they consult an attorney. The parents went ahead and retained a lawyer who subsequently negotiated a $250,000 settlement with the adjuster's insurance company for the claims relating to the boy's injury from the aerial bomb. If the parents assert a claim against the adjuster to recover damages for infliction of emotional distress, they will",mmlu,mmlu
mmlu:1086,"A city has adopted ordinance 172 which provides:""Section 1: It shall be unlawful for any person, group, or organization to hold a meeting of 50 persons or more in any city park without first securing a city permit;Section 2: The application shall specify the day and hours for which the permit is sought. The fee shall be $10 per hour, with a maximum fee of $50;Section 3: Permits shall be issued on a first come basis; provided that the police chief shall deny any application if, after hearing the applicant, it is his considered judgment that (a) the meeting would create serious traffic congestion, or (b) interfere with public enjoyment of the park, or (c) speakers at the meeting would advocate the commission of crime. ""A foreign exchange student planned to hold a demonstration at park in the city. Although the student's previous protest rallies attracted fewer than 25 demonstrators, he decided to apply for a permit pursuant to city ordinance 172. After meeting with the student, the chief of police denied his permit application because he believed that the demonstration would incite the protestors and threaten imminent violence or serious disorder. Subsequently, the student and his fellow demonstrators staged their rally at the park. The rally attracted only about 20 protestors and was conducted peacefully. As the student was making his final remarks to the gathering, the police arrived at the park and arrested the student and his fellow demonstrators charging them with violating ordinance 172. Which of the following would be the most accurate statement with regard to the arrest of the student and the other demonstrators?",mmlu,mmlu
mmlu:1107,A coach rounded the number of runners at a track meet to the nearest 10. The rounded number of runners is 400. Which number could be the actual number of runners at the track meet?,mmlu,mmlu
mmlu:1142,A company is interested in comparing the mean sales revenue per salesperson at two different locations. The manager takes a random sample of 10 salespeople from each location independently and records the sales revenue generated by each person during the last four weeks. He decides to use a t-test to compare the mean sales revenue at the two locations. Which of the following assumptions is necessary for the validity of the t-test?,mmlu,mmlu
mmlu:1346,A dime has a radius of about 0.85 cm. Which measurement is closest to the circumference of a dime?,mmlu,mmlu
mmlu:1351,"A disorder characterized by delusions of persecution, hallucinations, and disordered thinking is",mmlu,mmlu
mmlu:1355,"A doctor is charged with the murder of his wife. The prosecution alleges that he murdered his wife by giving her a massive injection of succinylcholine while she was asleep. Succinylcholine is a drug used in small quantities by anesthesiologists as a muscle relaxant. The prosecution claims that the fatal dose given to the wife so totally relaxed her lung muscles that she suffocated. During the trial, a toxicologist, who had no previous knowledge of the case, sat in court and heard all of the evidence about the wife's death and autopsy. As part of the doctor's defense, his attorney calls the toxicologist to give his opinion on the cause of the wife's death. May the toxicologist so testify?",mmlu,mmlu
mmlu:1385,"A farmer owned a tract of land in a state that has a notice recording statute and follows the title theory of mortgages. There were two farms situated on the property, one farm on the eastern half and one farm on the western half of the property. The farmer recorded a general warranty deed conveying the property to his son. Two years later, the son obtained a mortgage, secured by the farm property, in favor of his friend. The friend promptly recorded the mortgage. Twenty years later, the son sold the property to an investor by a general warranty deed, with the investor assuming the friend's mortgage. The following year, the investor subdivided the property and sold the western farm to a developer, while retaining the eastern farm. There was no mention of the mortgage in the general warranty deed between the investor and developer. The developer was unable to rezone the property to build houses as he had planned, so the developer sold the western farm to a florist. The conveyance to the florist made no mention of the friend's mortgage. Three years later, the florist entered into a contract with a rancher, pursuant to which the rancher would purchase the western farm for $75,000. The closing date for the deal was set for January 15. Assuming that on January 10, the rancher conducted a title search that revealed the friend's mortgage on the property, which of the following is correct?",mmlu,mmlu
mmlu:1418,"A female patient at a federal hospital reported that a male nurse sexually assaulted her. The man was arrested. At trial the prosecution offered evidence that the man was convicted of two prior sexual assault charges against two other women, both occurring about two years earlier. The allegations and the man's modus operandi in those convictions were almost identical to the instant case. Defense counsel objected to the evidence on the basis that its highly prejudicial effect outweighed its probative value. Based on the Federal Rules of Evidence, what will the court most likely rule regarding this issue?",mmlu,mmlu
mmlu:1430,A first-grade teacher is planning activities to introduce students to nonstandard units of measurement. Which of the following activities will best meet the teacher's goal?,mmlu,mmlu
mmlu:1491,A group's performance on a(n) __________ task is limited by the performance of the least skilled or knowledgeable member of the group.,mmlu,mmlu
mmlu:1493,"A gun dealer loaned a machine gun to a friend who told him only that he needed it to ""make some money."" The friend was arrested for robbing a bank with the machine gun. The government charged the gun dealer and the friend with conspiracy to commit bank robbery. Can the charge of conspiracy to commit bank robbery be upheld against the gun dealer?",mmlu,mmlu
mmlu:1508,A high school sent a survey to a randomly selected sample of 75 of last year's graduating class. 27 of those selected did not return the survey. The best plan of action would be to:,mmlu,mmlu
mmlu:1562,"A husband visits an attorney seeking a divorce because of his wife's infidelity. At the client consultation, the attorney's secretary took notes. With the permission bf the husband, the attorney's law clerk also sat in on the consultation to see how the attorney conducted these meetings. Shortly after this initial consultation with the attorney, the secretary quit. During the divorce trial, the wife's attorney seeks to call the secretary to testify about what the husband told the attorney during the initial client consultation. Upon objection, the secretary's proposed testimony will most likely be",mmlu,mmlu
mmlu:1611,"A landscaper agreed to maintain the yard of a homeowner for six months for a fee of $300 per month, payable at the end of the six-month period. This amount was the fair market value of the work to be performed. The landscaper performed the work for four months but was then offered another job for $500 per month and, after notifying the homeowner, stopped doing the promised work and took the other job. The homeowner refused to pay the landscaper anything. The homeowner could have hired a comparable landscaper to complete the work for $300 per month. In a lawsuit between the landscaper and the homeowner, what is the likely result?",mmlu,mmlu
mmlu:1626,"A law in one state forbids the transportation or sale of tomatoes in the state that have a more than 10% ""genetic engineering factor."" The U.S. Department of Agriculture does not use or mention genetic engineering factors in its standards for the sale and transportation of tomatoes. Tomato growers in a second state wish to ship tomatoes for sale into the first state but its tomatoes are in compliance only with the federal standards. The tomato growers' association in the second state brought an injunctive action in federal court against the agricultural department of the first state to enjoin enforcement of the genetic engineering rule on the basis of federal preemption. According to U.S. Supreme Court precedent, how will the courts decide the preemption claim?",mmlu,mmlu
mmlu:1684,"A man arranged to have custom-made wooden shutters installed on the windows of his home. The contractor who installed the shutters did so by drilling screws and brackets into the exterior window frames and the shutters. The man later agreed to sell the home to a buyer. The sales agreement did not mention the shutters, the buyer did not inquire about them, and the buyer did not conduct a walkthrough inspection of the home before the closing. The man conveyed the home to the buyer by warranty deed. After the sale closed, the buyer noticed that the shutters and brackets had been removed from the home and that the window frames had been repaired and repainted. The buyer demanded that the man return the shutters and pay the cost of reinstallation, claiming that the shutters had been conveyed to him with the sale of the home. When the man refused, the buyer sued. Is the buyer likely to prevail?",mmlu,mmlu
mmlu:1705,"A man filed a federal diversity action against a bus company, seeking damages for injuries he had sustained in an accident while riding a bus owned by the company. The man demanded a jury trial. After the parties' attorneys examined the prospective jurors and exercised their challenges, six jurors and two alternate jurors were chosen. During the trial, two jurors became ill and were replaced by the alternate jurors. At the conclusion of replaced by the alternate jurors. At the conclusion of the trial, a third juror also became ill, and the court excused that juror. The parties' attorneys stipulated to the return of a verdict from a five-person jury. The jury then deliberated and returned a verdict for the company. The man timely filed a motion for a new trial, arguing that the five-person jury was not large enough to return a verdict. Should the court grant the motion?",mmlu,mmlu
mmlu:1795,A math book and a physics book sitting on a table are tied together with a length of string. With the string taut one book is pushed off the edge of the table. As it falls the other book is dragged horizontally across the table surface. With no friction acceleration of the books is,mmlu,mmlu
mmlu:1807,"A meteorologist reports that there is a 30% probability of rain and no sun. If there is a 40% probability of no rain, then the probability of both rain and sun is",mmlu,mmlu
mmlu:1880,A number is rounded to the nearest hundred. The result is 500. Which number could not be the number before it was rounded to the nearest hundred?,mmlu,mmlu
mmlu:1957,"A person who is not very well organized, rarely sets goals, and frequently puts things off until the last minute would be said to be low on which trait?",mmlu,mmlu
mmlu:1983,A place where people lived and/or worked and where the physical evidence of their existence can be recovered is an archaeological:,mmlu,mmlu
mmlu:2021,"A point in space $(x,y,z)$ is randomly selected so that $-1\le x \le 1$,$-1\le y \le 1$,$-1\le z \le 1$. What is the probability that $x^2+y^2+z^2\le 1$?",mmlu,mmlu
mmlu:2057,"A previously healthy 37-year-old woman comes to the physician because of a 3-month history of episodes of severe anxiety, shortness of breath, palpitations, and numbness in her hands and feet. Her vital signs are within normal limits. Physical examination shows no abnormalities. Thyroid function studies and an ECG show no abnormalities. Which of the following is the most appropriate pharmacotherapy?",mmlu,mmlu
mmlu:2095,"A property owner who owner her property in fee simple leased a three-story house and the 21 -acre tract upon which it stood to a friend for a term of 10 years. By the terms of the lease, the friend expressly covenanted to pay a monthly rental of $300 and to pay the taxes on the premises during the term of the lease. The lease also stipulated that the friend, as lessee, may not assign or sublease the said premises. The friend and his family lived in the house for two years. Then the friend assigned his leasehold interest in the property to a cousin, who was unaware of the prohibition against assignments. This written assignment expressly provided that the cousin would pay the owner the monthly rental of $300, but was silent concerning the payment of taxes. The owner never objected to this assignment. Six months after the assignment, the owner conveyed her property interest in the premises to a developer. During the cousin's tenancy, the State Highway Authority filed proceedings to condemn two acres of the tract for the purpose of highway construction. As a result, the cousin contacted the developer and informed him that he should be entitled to an apportioned reduction in the rental. After the developer refused to reduce the rent, the cousin brings an action to have his rent apportioned pro tanto. Judgment should be for",mmlu,mmlu
mmlu:2145,A recent comparison of the intelligence scores of Asian Americans and African Americans on the Stanford-Binet showed that,mmlu,mmlu
mmlu:2227,"A scientist using mouse models to determine the response of blood hormones to large levels of glucose in the body discovers a new hormone not previously described. According to his data, this hormone is found both inside and out of cells when carrying out its function, increase the amount of nucleic acid in the cell while functioning, and are derived from a structure containing four hydroxycarbon rings. This will likely be categorized as which type of hormone?",mmlu,mmlu
mmlu:2236,A second-year college student is usually called a what?,mmlu,mmlu
mmlu:2238,"A security guard had a license to carry a concealed handgun. One day, he was walking past a barber shop when he saw his friend inside getting a haircut. The security guard knew that the barber, an elderly man, had a history of significant heart problems. The security guard decided to play a joke on his friend. The security guard took out his gun, burst through the door of the barber shop, pointed the gun at the friend, and shouted, ""Don't move or I'll shoot!"" The barber, thinking that an armed intruder was about to shoot the friend, suffered a heart attack and collapsed. If the barber brings suit against the security guard for infliction of emotional distress and seeks recovery for damages arising from the heart attack, he should",mmlu,mmlu
mmlu:2254,"A sexually active 20-year-old woman has had fever, chills, malaise, and pain of the vulva for 2 days. Examination shows a vulvar pustule that has ulcerated and formed multiple satellite lesions. Nodes are palpated in the inguinal and femoral areas. A smear of fluid from the lesions establishes the diagnosis. Which of the following is the most likely causal organism?",mmlu,mmlu
mmlu:2264,"A shopper purchased a can of sardines, which had been produced by a fish company. A short while later at home, the shopper was preparing a sardine sandwich when she opened the can and, to her astonishment, she saw a decomposed mouse. The shopper became nauseated and vomited upon seeing the mouse. After consulting her attorney, the shopper initiated a strict liability action against the company. At trial, the shopper presented into evidence the sardine can with the company's label, along with other corroborating evidence. The attorney representing the company objected to the introduction of the label on the can. The trial court should",mmlu,mmlu
mmlu:2271,A significance test of the hypothesis H0: p= 0.3 against the alternative HA: p> 0.3 found a value of = 0.35 for a random sample of size 95. What is the P-value of this test?,mmlu,mmlu
mmlu:2301,"A solution contains a mixture of four different compounds: KCl(aq), Fe(NO3)3(aq), MgSO4(aq), and N2H4(aq). Which of these compounds would be easiest to separate via distillation?",mmlu,mmlu
mmlu:2319,A sports talk show asks people to call in and give their opinion of the officiating in the local basketball team's most recent loss. What will most likely be the typical reaction?,mmlu,mmlu
